### ISSUE TITLE
ping from pod to pod or outside network doesn't work using sriov host device plugin

### ISSUE THREAD

**Issue by kouamdo** [k8snetworkplumbingwg/sriov-network-device-plugin#534]
Hi , since i'm trying to ping or to make 
so i'm using host device cni plugin and associat it to 2 VF interface.
That is my config : 

```
apiVersion: v1
kind: ConfigMap
metadata:
  name: sriovdp-config
  namespace: kube-system
data:
  config.json: |
    {
        "resourceList": [{
                "resourceName": "intel_sriov_ixgbevf",
                "selectors": {
                    "vendors": ["8086"],
                    "devices": ["10ed"],
                    "drivers": ["ixgbevf"],
                    "pciAddresses": ["0000:00:04.0","0000:00:05.0","0000:00:06.0"]
                }
            }
        ]
    }
---
apiVersion: "k8s.cni.cncf.io/v1"
kind: NetworkAttachmentDefinition
metadata:
  name: n3-dp-net
  namespace: open5gs
  annotations:
    k8s.v1.cni.cncf.io/resourceName: intel.com/intel_sriov_ixgbevf
spec:
  config: '{
            "cniVersion": "0.3.1",
            "plugins": [
                {
                    "type": "host-device",
                    "capabilities": { "ips": true },
                    "ipam": {
                        "type": "static"
                    }
                }]
        }'
---
apiVersion: "k8s.cni.cncf.io/v1"
kind: NetworkAttachmentDefinition
metadata:
  name: n6-dp-net
  namespace: open5gs
  annotations:
    k8s.v1.cni.cncf.io/resourceName: intel.com/intel_sriov_ixgbevf
spec:
  config: '{
            "cniVersion": "0.3.1",
            "plugins": [
                {
                    "type": "host-device",
                    "capabilities": { "ips": true },
                    "ipam": {
                        "type": "static"
                    }
                }]
        }'
```
```
apiVersion: apps/v1
kind: Deployment
metadata:
  name: eupf
  namespace: open5gs
  labels:
    epc-mode: eupf
spec:
  replicas: 1
  selector:
    matchLabels:
      epc-mode: eupf
  template:
    metadata:
      annotations:
        "cni.projectcalico.org/ipAddrs": "[\"10.240.233.73\"]"
        k8s.v1.cni.cncf.io/networks: '[
          {
            "name" : "n3-dp-net",
            "interface": "n3if",
            "ips": ["172.16.0.12/24"]
          },
          {
            "name" : "n6-dp-net",
            "interface": "n6if",
            "ips": ["172.18.0.12/24"]
          }
        ]'
      labels:
        epc-mode: eupf
      containers:
      - name: eupf
        image: docker.io/local/eupf:latest
        imagePullPolicy: IfNotPresent
        securityContext:
          privileged: true
        command:
          - /bin/sh
          - -c
          - >
            sh /app/bin/entrypoint.sh --config /app/bin/eupf_config.yml
        resources:
          requests:
            intel.com/intel_sriov_ixgbevf: '2'
          limits:
            intel.com/intel_sriov_ixgbevf: '2'
---
apiVersion: apps/v1
kind: Deployment
metadata:
  name: nat-dn
  namespace: open5gs
  labels:
    epc-mode: nat-dn
spec:
  replicas: 1
  selector:
    matchLabels:
      epc-mode: nat-dn
  template:
    metadata:
      annotations:
        "cni.projectcalico.org/ipAddrs": "[\"10.240.233.93\"]"
        k8s.v1.cni.cncf.io/networks: '[
          {
            "name" : "n6-dp-net",
            "interface": "n6if",
            "ips": ["172.18.0.13/24"]
          }
        ]'
      labels:
        epc-mode: nat-dn
    spec:
      containers:
      - name: dn-nat
        image: docker.io/local/dnnat:latest
        imagePullPolicy: IfNotPresent
        securityContext:
          privileged: true
        command:
          - /bin/sh
          - -c
          - >
            sysctl -w net.ipv6.conf.all.disable_ipv6=1;
            echo 1 > /proc/sys/net/ipv4/ip_forward;
            echo "done";
            tail -f /dev/null
        resources:
          requests:
            intel.com/intel_sriov_ixgbevf: '1'
          limits:
            intel.com/intel_sriov_ixgbevf: '1'
```
let me show you the route that was generated : 

```
k exec -n open5gs -it nat-dn-85b868dd46-ll7dm -- ip r
default via 169.254.1.1 dev eth0 
169.254.1.1 dev eth0 scope link 
172.18.0.0/24 dev n6if proto kernel scope link src 172.18.0.13 
root@ip-172-31-34-124:/home/ubuntu# k exec -n open5gs -it nat-dn-85b868dd46-ll7dm -- route -n
Kernel IP routing table
Destination     Gateway         Genmask         Flags Metric Ref    Use Iface
0.0.0.0         169.254.1.1     0.0.0.0         UG    0      0        0 eth0
169.254.1.1     0.0.0.0         255.255.255.255 UH    0      0        0 eth0
172.18.0.0      0.0.0.0         255.255.255.0   U     0      0        0 n6if
```

```
k exec -n open5gs -it eupf-75567b7754-pc7vw -- ip r 
default via 169.254.1.1 dev eth0 
169.254.1.1 dev eth0 scope link 
172.16.0.0/24 dev n3if scope link  src 172.16.0.12 
172.18.0.0/24 dev n6if scope link  src 172.18.0.12 
root@ip-172-31-34-124:/home/ubuntu# k exec -n open5gs -it eupf-75567b7754-pc7vw -- route -n
Kernel IP routing table
Destination     Gateway         Genmask         Flags Metric Ref    Use Iface
0.0.0.0         169.254.1.1     0.0.0.0         UG    0      0        0 eth0
169.254.1.1     0.0.0.0         255.255.255.255 UH    0      0        0 eth0
172.16.0.0      0.0.0.0         255.255.255.0   U     0      0        0 n3if
172.18.0.0      0.0.0.0         255.255.255.0   U     0      0        0 n6if
```

So when i tried to ping within the n6-dp-net it was failed, and there is the issue : 

```
k exec -n open5gs -it nat-dn-85b868dd46-w44cv -- tcpdump -ni n6if -vv
tcpdump: listening on n6if, link-type EN10MB (Ethernet), capture size 262144 bytes
06:44:10.808862 ARP, Ethernet (len 6), IPv4 (len 4), Request who-has 172.18.0.12 tell 172.18.0.13, length 28
06:44:11.836793 ARP, Ethernet (len 6), IPv4 (len 4), Request who-has 172.18.0.12 tell 172.18.0.13, length 28
06:44:12.856792 ARP, Ethernet (len 6), IPv4 (len 4), Request who-has 172.18.0.12 tell 172.18.0.13, length 28
06:44:13.880861 ARP, Ethernet (len 6), IPv4 (len 4), Request who-has 172.18.0.12 tell 172.18.0.13, length 28
```
u'mhesitate to use ip route inside those pods because i think i could bring a good configuration inside the network attachement definition to bring communication
i'm using microk8 `MicroK8s v1.28.7 revision 6541`

please can you tell me where i have done mistake ?

**Comment by SchSeba** [comment]
Hi @kouamdo everything looks good from the device plugin point of view. please check that you have the right L2 connection between the pods.

also if you want to exist the network (a different L3) using the sriov interface you will need to add routes to the ipam section with everything you need.

https://www.cni.dev/plugins/current/ipam/

**Comment by kouamdo** [comment]
I have added route for IPAM , but the ping doesn't work.also , using "route" avoid pod to ping outside.

I think that It is better to test L2 connections between pods like you have said

**Comment by kouamdo** [comment]
hi , until now the ping doesn't work between the 2 pods .
So let me show you the topo.
I have installed microk8s in ec2 instance(c4.2Xlarge) , and i'm trying to use sriov cni and fired it inside 3 devices(ENI) that has private ip address and public address also):

![Diagramme sans nom](https://github.com/k8snetworkplumbingwg/sriov-network-device-plugin/assets/39982727/aeda67ef-76f3-4ac2-83a2-bba5e6889a19)

i'm facing the same issue ; the ping between the 2 pods is not working ithin those *n6if* interfaces.
i was thinked about security group or something like firewall , but it didn't resolv that problem.

please let me know where i have done mistake or tell me more about multus host device and ec2 instance

**Comment by SchSeba** [comment]
This must be something in the platform/host itself.

if the device is inside the pod and you see in tcpdump that the arp request is going out (and check in the second pod that you don't see the arp request) then it must be something in the platform

**Comment by kouamdo** [comment]
I'm trying to use multus workload  implement  by aws.
I'm hoping that it will fix that issue

**Comment by SchSeba** [comment]
Hi @kouamdo let me know if I can close this issue thanks!
